brand,price_band,total_products,total_reviews,avg_selling_price,price_min,price_max,avg_discount_pct,avg_actual_rating,avg_sentiment_score,value_score,avg_wheels,avg_handle,avg_zipper,avg_material,avg_weight,avg_size,avg_lock,avg_durability,top_positives,top_negatives,anomalies
American Tourister,Upper Mid,8,9254,4320.0,2549.0,6895.0,25.9,4.24,7.9,1.83,9.2,7.8,6.8,8.1,5.3,7.4,7.8,8.1,"[""Smooth Wheels"", ""Good Size"", ""Durable Material"", ""Spaciousness"", ""Premium Feel/Material""]","[""Heavy Weight"", ""Pricey"", ""Weight"", ""Price"", ""Light/Flimsy""]","Despite a listed rating of 4.3/5, the weight issue appears to be a more significant concern than the price suggests, impacting perceived value."
Aristocrat,Mid-Range,11,39376,2340.0,442.0,5099.0,18.0,4.18,7.16,3.06,5.4,6.8,6.3,5.8,8.5,8.6,7.6,5.0,"[""Spaciousness"", ""Lightweight"", ""Value for Money"", ""Value for money"", ""Variety of sizes""]","[""Wheel Durability"", ""Material Thinness"", ""Material quality"", ""Wheel durability"", ""Handle sturdiness""]","The significant price point (Rs. 5099) doesn't seem to correlate with the reported durability issues, suggesting a potential quality control problem. | Despite the low price, customers are pleasantly surprised by the overall functionality, but the wheel quality seems to be a recurring and significant issue. | The low price point is a significant driver of purchase, but also contributes to the perception of compromised quality. | Despite a listed rating of 4.3/5, a significant number of reviews express concerns about the product's durability, suggesting a potential disconnect between perceived quality and actual performance."
Nasher Miles,Upper Mid,11,8991,3482.0,2599.0,6179.0,24.2,4.12,7.7,2.21,8.3,6.9,5.8,7.8,7.4,8.3,6.9,7.1,"[""Lightweight"", ""Stylish Design"", ""Smooth Rolling Wheels"", ""Spinner Wheels"", ""Size""]","[""Concerns about Lock Durability"", ""Price Relative to Competitors"", ""Handle Stability"", ""Wheel Durability"", ""Handle retraction""]","The significant contrast between positive comments about wheel performance and the single report of wheel breakage is noteworthy. | Service center availability seems to be a concern for some customers in certain regions. | The handle breaking after only a few uses is a significant and unexpected issue given the generally positive feedback on build quality. | The lack of readily available service centers is a significant drawback compared to established brands like Safari. | The price point seems to be a point of contention, with some customers feeling it's not justified despite the perceived value."
Safari,Upper Mid,10,182194,3174.0,1599.0,5849.0,23.1,4.07,7.67,2.42,9.1,5.3,5.8,7.6,8.0,7.9,6.8,6.9,"[""Smooth Wheels"", ""Good Value for Money"", ""Sturdy Build"", ""Stylish Design"", ""Lightweight""]","[""Handle Loosening"", ""Cheap Zipper"", ""Durability Concerns"", ""Handle Wobble"", ""Zipper Weakness""]","Despite a listed rating of 4.2, the negative reviews highlight a significant durability issue that warrants further investigation."
Skybags,Mid-Range,9,63211,2633.0,692.0,5639.0,20.0,4.11,7.4,2.81,5.4,6.4,4.2,7.0,8.7,8.1,7.5,5.8,"[""Lightweight"", ""Stylish Design"", ""Good Value for Money"", ""Print Design"", ""Value for Price""]","[""Zipper Quality"", ""Wheel Durability/Wobbling"", ""Wheels"", ""Durability Concerns"", ""Zipper quality""]","Despite the listed price being relatively low, some reviews express disappointment proportional to expectations of higher quality."
Vip,Upper Mid,4,243,4087.0,2299.0,7700.0,21.9,4.0,7.5,1.84,8.2,7.2,6.4,7.4,6.2,7.5,6.3,7.0,"[""Durability"", ""Smooth Rolling Wheels"", ""Build Quality"", ""Lightweight"", ""Handle Comfort""]","[""Weight"", ""Design (Dated)"", ""Size (Bulky)"", ""Zipper Issues"", ""Durability Concerns""]",The significant durability issues reported in one review contrast with the generally positive feedback on other aspects.
